{
  "format": "affinity-map",
  "version": "0.1",
  "subject": {
    "question": "How can accountability remain reachable without forcing immediate conversion?"
  },
  "sources": [
    {"id": "S01", "ref": "example source A"},
    {"id": "S02", "ref": "example source B"}
  ],
  "cards": [
    {
      "id": "C001",
      "text": "人格否定ではなく具体的な行為へ話を戻すと、自己防御を強めず責任を扱える。",
      "source_refs": ["S01"]
    },
    {
      "id": "C002",
      "text": "その場での改心を迫らず、理解や反応に時間差が生じる余地を残す。",
      "source_refs": ["S02"]
    },
    {
      "id": "C003",
      "text": "反発を避けることが、責任そのものを曖昧にする方向へ流れる危険もある。",
      "source_refs": ["S02"]
    }
  ],
  "groups": [
    {
      "id": "G01",
      "label": "自己防御を過度に刺激せず、具体的な責任行為へ戻れる通路を保つ",
      "members": ["C001", "C002"],
      "preserved_differences": [
        "C001は話の焦点の置き方を扱い、C002は時間差を扱う。"
      ]
    },
    {
      "id": "G02",
      "label": "配慮が責任の希薄化へ変わる境界は別に監査する必要がある",
      "members": ["C003"]
    }
  ],
  "resonances": [
    {
      "id": "X01",
      "from": "C003",
      "to": "G01",
      "note": "G01の成立条件を裏側から限定するが、G01のmemberとして同化しない。"
    }
  ],
  "relations": [
    {
      "id": "R01",
      "from": "G01",
      "to": "G02",
      "direction": "directed",
      "predicate": "通路を保つ配慮は、責任の希薄化へ変わる境界を同時に監査する必要を生む",
      "state": "supported as synthesis",
      "basis": ["C001", "C002", "C003"]
    }
  ],
  "questions": [
    {
      "id": "Q01",
      "text": "時間差を許すことが、どの条件で責任放棄へ変わるのか",
      "arises_from": ["G01", "G02"]
    }
  ]
}
